{
  "recordKind": "hacp.v0_3_candidate.continuation_context",
  "schemaVersion": "hacp-0.3-candidate",
  "contextId": "context_example_successor_001",
  "requiredExtension": {
    "profileId": "hacp-accountable-continuation-v0.3-candidate",
    "profileVersion": "hacp-0.3-candidate",
    "extensionAwareProcessingRequired": true
  },
  "decision": {
    "id": "decision_example_approve_successor_001",
    "digest": {
      "algorithm": "sha256",
      "canonicalization": "json-rfc8785-jcs",
      "digestDomain": "io.hacp.human-decision.v0.3-candidate",
      "value": "545b43ca3c706c47090d953189d984506e6009a5efe5cfe03400edc0abcc0e0b"
    }
  },
  "consumptionReceipt": {
    "id": "receipt_example_claim_successor_001",
    "digest": {
      "algorithm": "sha256",
      "canonicalization": "json-rfc8785-jcs",
      "digestDomain": "io.hacp.consumption-receipt.v0.3-candidate",
      "value": "826e13a192113d89e805ecd906d004cbe55e018e55721871d8c95a8a8f3d5bc1"
    }
  },
  "successorInvocationId": "invoke_example_docs_worker_001",
  "digest": {
    "algorithm": "sha256",
    "canonicalization": "json-rfc8785-jcs",
    "digestDomain": "io.hacp.continuation-context.v0.3-candidate",
    "value": "004fdf803d6bfe61a18f71ae8f350013ae5232d866352ec83387d9ff6114d3e1"
  },
  "boundaryStatement": "Illustrative required input, not active authority. The consumer must authenticate the context integrity through its independently trusted human-approved profile; a self-supplied digest is insufficient. Revocation/current-status policy and external proof remain unresolved."
}
